{
  "$schema": "https://json-schema.org/draft/2020-12/schema",
  "$id": "https://github.com/future3317/scientific-performance-engineering/relation_spec.schema.json",
  "title": "RelationSpec",
  "type": "object",
  "additionalProperties": false,
  "required": [
    "relation_id",
    "version",
    "parent",
    "endpoints",
    "orientation",
    "kind",
    "applicability",
    "contrast_definition",
    "practical_margin",
    "scientific_invariants",
    "provenance_policy"
  ],
  "properties": {
    "relation_id": {
      "type": "string",
      "minLength": 1
    },
    "version": {
      "type": "integer",
      "minimum": 1
    },
    "parent": {
      "type": [
        "string",
        "null"
      ]
    },
    "endpoints": {
      "type": "object",
      "additionalProperties": false,
      "required": [
        "left",
        "right"
      ],
      "properties": {
        "left": {
          "type": "string",
          "minLength": 1
        },
        "right": {
          "type": "string",
          "minLength": 1
        }
      }
    },
    "orientation": {
      "enum": [
        "symmetric",
        "left_to_right",
        "right_to_left"
      ]
    },
    "kind": {
      "enum": [
        "synergy",
        "antagonism",
        "independence",
        "prerequisite",
        "redundancy",
        "semantic_conflict",
        "context_dependent_interaction"
      ]
    },
    "applicability": {
      "type": "object",
      "minProperties": 1
    },
    "contrast_definition": {
      "type": "object",
      "minProperties": 1
    },
    "practical_margin": {
      "type": "number",
      "minimum": 0
    },
    "scientific_invariants": {
      "type": "array",
      "items": {
        "type": "string"
      }
    },
    "provenance_policy": {
      "type": "object"
    }
  }
}
